category,title,content_text,news_name,creatrion_time
경제,올해 국내 발전소 설비용량 100GW 시대 열린다,       전년 대비 10GW 확대 예정…온실가스 주범 석탄발전 많이 늘어올해 원자력 및 화력발전소가 대거 신규 가동되면서 국내 발전설비 용량 100기가와트(GW) 시대가 열릴 전망이다. 다만 이같은 용량 확대가 온실가스 배출이 많은 석탄발전에 주로 힘입은 만큼 관련 대책이 필요하다는 지적이다.25일 에너지업계에 따르면 지난해 말 전국의 발전설비 용량은 97.6GW로 집계됐다. 액화천연가스(LNG) 발전이 전체의 33%인 32.2GW였고 석탄화력발전이 28%(27.3GW), 원자력 22.2%(21.7GW), 신재생에너지 7.6%(7.4GW) 등의 순이었다.올해는 대규모 발전설비가 신규 가동되면서 용량 100GW를 돌파할 전망이다. 4월 신고리 원전 3호기(1.4GW)를 비롯해 당진 석탄화력발전소 9·10호기(2GW), 태안 석탄화력발전소 9·10호기(2GW) 등 9GW 규모의 석탄발전소가 신규 가동된다.이에 따라 올해 국내 전력시장의 발전설비 용량은 총 108.7GW에 달할 것으로 추정된다. 2005∼2015년 발전설비 용량은 연평균 3.5GW 증가했다. 올해만 10GW 가까운 설비가 신규 가동되면서 증가량은 역대 최대를 기록할 것으로 전망된다.다만 확대되는 발전설비가 원전인 신고리 3호기를 제외하고는 모두 석탄발전이라는 점은 우려되는 요인이다. 예정대로 가동에 들어가면 석탄발전소 설비용량은 올해 36GW로 지난해 1위인 LNG를 제치고 전체 전원 중 1위에 오르게 된다. 석탄발전은 ‘값싼 연료비’라는 장점은 있지만 LNG의 2.2배가 넘는 온실가스 배출량이 단점이다.그린피스에 따르면 석탄은 전 세계 화석연료에서 배출되는 탄소 배출량의 44%를 차지해 모든 에너지원 중에서 가장 많은 탄소를 배출하고 있다.게다가 최근 LNG 가격이 많이 떨어지면서 석탄발전과의 격차도 줄어들고 있다. 정부는 2011년 순환정전 사태 이후 원자력과 석탄 등 기저발전을 대거 발전시장에 진입시키기로 했다.문제는 석탄발전소의 경우 공사 기간이 길다 보니 막상 전력이 남아돌게 된 지난해 이후 순차적으로 시장에 진입하고 있다는 점이다. 온실가스 감축 등을 위해 석탄 사용을 줄이고 LNG 사용을 늘리는 최근의 에너지시장 트렌드에 우리나라만 역행하고 있는 셈이다.실제 미국은 2035년까지 신규 발전의 60%를 가스발전으로 확충할 방안을 발표했고 영국도 2025년까지 석탄화력 발전을 전면 폐쇄할 계획을 세워놓고 있다.중국은 올해까지 총 6천만톤(t)의 석탄생산을 줄이는 등 전 세계적으로 온실가스 감축을 위해 석탄사용을 자제하거나 축소하는 분위기다.업계 관계자는 “전력이 남아도는 상황에서 석탄발전의 비중이 커지면서 온실가스 감축이라는 정부의 또다른 목표와 엇박자를 내고 있는 만큼 관련 대책 마련이 필요하다”고 말했다.임소형기자 precare@hankookilbo.com[아직 모르시나요? 반칙없는 뉴스 바로가기] [한국일보 페이스북] [신문에는 없는 뉴스] [꿀잼 동영상][ⓒ 한국일보(hankookilbo.com), 무단 전재 및 재배포 금지] , ,한국일보,2016-01-25 09:08:00
경제,올해 국내 발전소 설비용량 100GW 시대 열린다…전년 대비 10GW 확대 예정…온실가스 주범 석탄발전 많이 늘어,       , ,[헤럴드경제=황해창 기자] 올해 원자력 및 화력발전소가 대거 신규 가동되면서 국내 발전설비 용량 100기가와트(GW) 시대가 열릴 전망이다. 문제는 용량 확대가 온실가스 배출이 많은 석탄발전에 편중돼 있어 후속대책이 요망된다.25일 에너지업계에 따르면 지난해 말 전국의 발전설비 용량은 97.6GW로 집계됐다. 액화천연가스(LNG) 발전이 전체의 33%인 32.2GW였고 석탄화력발전이 28%(27.3GW), 원자력 22.2%(21.7GW), 신재생에너지 7.6%(7.4GW) 등의 순이었다.올해는 대규모 발전설비가 신규 가동되면서 용량 100GW를 돌파할 전망이다. 오는 4월 신고리 원전 3호기(1.4GW)를 비롯해 당진 석탄화력발전소 9·10호기(2GW), 태안 석탄화력발전소 9·10호기(2GW) 등 9GW 규모의 석탄발전소가 신규 가동된다.이에 따라 올해 국내 전력시장의 발전설비 용량은 총 108.7GW에 달할 것으로 추정된다.2005∼2015년 발전설비 용량은 연평균 3.5GW 증가했다. 올해만 10GW 가까운 설비가 신규 가동되면서 증가량은 역대 최대를 기록할 것으로 전망된다.다만 확대되는 발전설비가 원전인 신고리 3호기를 제외하고는 모두 석탄발전이라는 점은 우려되는 요인이다. 예정대로 가동에 들어가면 석탄발전소 설비용량은 올해 36GW로 지난해 1위인 LNG를 제치고 전체 전원 중 1위에 오르게 된다.석탄발전은 ‘값싼 연료비’라는 장점은 있지만 LNG의 2.2배가 넘는 온실가스 배출량이 단점이다.그린피스에 따르면 석탄은 전 세계 화석연료에서 배출되는 탄소 배출량의 44%를차지해 모든 에너지원 중에서 가장 많은 탄소를 배출하고 있다. 게다가 최근 LNG 가격이 많이 떨어지면서 석탄발전과의 격차도 줄어들고 있다. 정부는 2011년 순환정전 사태 이후 원자력과 석탄 등 기저발전을 대거 발전시장에 진입시키기로 했다.석탄발전소의 경우 공사 기간이 길다 보니 막상 전력이 남아돌게 된 지난해 이후 순차적으로 시장에 진입하고 있다는 점이다. 인천화력발전소 [사진=헤럴드DB]온실가스 감축 등을 위해 석탄 사용을 줄이고 LNG 사용을 늘리는 최근의 에너지시장 트렌드에 우리나라만 역행하고 있는 셈이다.실제 미국은 오는 2035년까지 신규 발전의 60%를 가스발전으로 확충할 방안을 발표했고 영국도 2025년까지 석탄화력 발전을 전면 폐쇄할 계획을 세워놓고 있다.중국은 올해까지 총 6000만톤t의 석탄생산을 줄이는 등 전 세계적으로 온실가스 감축을 위해 석탄사용을 자제하거나 축소하는 분위기다. hchwang@heraldcorp.com[글로벌 인재들의 필수 역량, SKEC 영어글쓰기대회] [주니어 영어 신문의 가장 효율적인 학습 서비스][헤럴드경제] [SUPERICH] [REAL FOODS] [헤럴드증권방송] [HOOC]- Copyrights ⓒ 헤럴드경제 & heraldbiz.com, 무단 전재 및 재배포 금지 - , ,헤럴드경제,2016-01-25 06:45:00
경제,올해 국내 발전소 설비용량 100GW 시대 열린다,         전년 대비 10GW 확대 예정…온실가스 주범 석탄발전 많이 늘어    (서울=연합뉴스) 박대한 기자 = 올해 원자력 및 화력발전소가 대거 신규 가동되면서 국내 발전설비 용량 100기가와트(GW) 시대가 열릴 전망이다.    다만 이같은 용량 확대가 온실가스 배출이 많은 석탄발전에 주로 힘입은 만큼 관련 대책이 필요하다는 지적이다.    25일 에너지업계에 따르면 지난해 말 전국의 발전설비 용량은 97.6GW로 집계됐다.    액화천연가스(LNG) 발전이 전체의 33%인 32.2GW였고 석탄화력발전이 28%(27.3GW), 원자력 22.2%(21.7GW), 신재생에너지 7.6%(7.4GW) 등의 순이었다.    올해는 대규모 발전설비가 신규 가동되면서 용량 100GW를 돌파할 전망이다.    오는 4월 신고리 원전 3호기(1.4GW)를 비롯해 당진 석탄화력발전소 9·10호기(2GW), 태안 석탄화력발전소 9·10호기(2GW) 등 9GW 규모의 석탄발전소가 신규 가동된다.    이에 따라 올해 국내 전력시장의 발전설비 용량은 총 108.7GW에 달할 것으로 추정된다.    2005∼2015년 발전설비 용량은 연평균 3.5GW 증가했다. 올해만 10GW 가까운 설비가 신규 가동되면서 증가량은 역대 최대를 기록할 것으로 전망된다.    다만 확대되는 발전설비가 원전인 신고리 3호기를 제외하고는 모두 석탄발전이라는 점은 우려되는 요인이다.    예정대로 가동에 들어가면 석탄발전소 설비용량은 올해 36GW로 지난해 1위인 LNG를 제치고 전체 전원 중 1위에 오르게 된다.     석탄발전은 '값싼 연료비'라는 장점은 있지만 LNG의 2.2배가 넘는 온실가스 배출량이 단점이다.    그린피스에 따르면 석탄은 전 세계 화석연료에서 배출되는 탄소 배출량의 44%를 차지해 모든 에너지원 중에서 가장 많은 탄소를 배출하고 있다.    게다가 최근 LNG 가격이 많이 떨어지면서 석탄발전과의 격차도 줄어들고 있다.    정부는 2011년 순환정전 사태 이후 원자력과 석탄 등 기저발전을 대거 발전시장에 진입시키기로 했다.    문제는 석탄발전소의 경우 공사 기간이 길다 보니 막상 전력이 남아돌게 된 지난해 이후 순차적으로 시장에 진입하고 있다는 점이다.    온실가스 감축 등을 위해 석탄 사용을 줄이고 LNG 사용을 늘리는 최근의 에너지시장 트렌드에 우리나라만 역행하고 있는 셈이다.    실제 미국은 오는 2035년까지 신규 발전의 60%를 가스발전으로 확충할 방안을 발표했고 영국도 2025년까지 석탄화력 발전을 전면 폐쇄할 계획을 세워놓고 있다.    중국은 올해까지 총 6천만톤(t)의 석탄생산을 줄이는 등 전 세계적으로 온실가스 감축을 위해 석탄사용을 자제하거나 축소하는 분위기다.    업계 관계자는 -전력이 남아도는 상황에서 석탄발전의 비중이 커지면서 온실가스 감축이라는 정부의 또다른 목표와 엇박자를 내고 있는 만큼 관련 대책 마련이 필요하다-고 말했다.<표> 발전설비 용량 변화    pdhis959@yna.co.kr▶ [영상] 역대 최강 한파, 내일까지 지속…전국 '냉동고'▶ [오늘의 핫 화보] 미국 '스노마겟돈' 공포·중국 영하 50도 '냉동고',연합뉴스,2016-01-25 06:31:00
경제,조환익 사장 “전기료 지금 내리는 건 교각살우”,       , ,[동아일보]한전 역대 세번째 연임… 조환익 사장 인터뷰조환익 한국전력공사 사장은 22일 동아일보와의 인터뷰에서 일각에서 제기되는 전기요금 인하 주장에 대해 “지금의 흑자는 요금 인하보다는 에너지 신산업 투자에 쓰여야 한다”며 부정적인 반응을 보였다.  김경제 기자 kjk5873@donga.com《 “섣부른 전기요금 인하는 ‘교각살우(矯角殺牛·쇠뿔을 바로 잡으려다 소를 죽인다)’와 같다.” 조환익 한국전력공사 사장은 22일 서울 서초구 서초동 한전아트센터에서 가진 동아일보와의 단독 인터뷰에서 일각에서 제기된 전기요금 인하 주장을 이같이 일축했다. 유가 하락을 반영해 일시적으로 전기요금을 내리면 전력 소비 체계를 왜곡해 득보다 실이 많을 수 있다는 지적이다. 하지만 원가 이하로 공급되고 있는 산업용 전기요금과 관련해서는 요금 체계 개편의 필요성을 언급했다. 》○ “전기요금 인하는 반대, 산업용은 개편 필요” 지난해 한전이 서울 강남구 삼성동 본사 매각 등으로 사상 최대 실적을 거두자 전기요금 인하 주장이 힘을 받고 있다. 최근 국제유가의 하락으로 전기 생산비용이 줄어든 데다 적극적인 소비를 유도하려면 전기요금 인하가 필요하다는 주장이다. 이에 대해 조 사장은 “유가가 내렸다고 전기요금을 내리면 전기 사용량도 늘게 된다”며 “요금을 내리기보다 온실가스 감축 등을 위한 투자를 늘려야 할 때”라고 말했다. 산업용 전기요금에 대해선 “요금 체계를 개편할 필요는 있다”고 밝혔다. 조 사장은 “지금처럼 산업 분야별로 요금을 부과하지 않고 전압별로 부과하는 방식 등으로 개편하는 것이 바람직하다”고 덧붙였다. 주택용, 산업용 등 용도별로 요금을 차등 부과하지 않고 전압별 단일 요금 기준을 적용하되 낮은 요금이 적용되는 시간을 늘리거나 전력수요 분산을 유도해 기업 부담이 급격히 늘어나지 않도록 조정하겠다는 것이다. 한전은 올해 중국의 발전기업과 합작법인을 만들어 해외 발전소 사업을 수주하는 방안을 추진할 계획이다. 저가수주도 마다하지 않는 중국과 해외 시장에서 출혈 경쟁을 벌이기보다 상호 협력을 통해 돌파구를 찾겠다는 것이다. 한국의 우수한 설계·조달 능력과 중국의 시공 능력이 결합되면 수익성을 크게 개선할 수 있다는 것이다. 한전이 현지 기업이나 일본 기업이 아닌 중국 기업과 컨소시엄을 구성해 해외 수주에 나선 적은 없었다. 조 사장은 “해외 발전소 건설시장이 레드오션으로 바뀌고 있다”며 “이제는 중국을 파트너로 삼아 해외에 함께 나가야 한다”고 강조했다. 이를 위해 조 사장은 2월경 중국을 방문해 중국 최대 발전기업인 화넝(華能)집단과 구체적 협력방안을 논의할 예정이다.○ “신기후체제 위기 아닌 기회” 조 사장은 한전 역사상 세 번째로 연임을 눈앞에 두고 있다. 그런 만큼 “올 한 해 강력한 드라이브를 걸겠다”며 강력한 경영 혁신을 예고했다. 에너지 신산업에 대한 투자를 확대하고 전력산업의 생태계를 바꾸는 데 한전이 앞장서겠다는 것이다. 조 사장은 “2020년 출범을 앞둔 글로벌 신기후체제가 위기가 아닌 기회가 될 것”이라며 “신재생에너지, 대용량 전기저장장치(ESS), 스마트그리드(지능형 전력망)에서 새로운 성장동력을 찾겠다”고 말했다. 다른 나라보다 앞선 정보통신기술(ICT)과 에너지 산업의 융합을 통해 일자리를 만들고 부가가치를 높이겠다는 것이다.  대한전기협회장도 맡고 있는 조 사장은 “대한전기협회가 중심이 돼 정부와의 협의를 통해 ESS 분야 핵심 기능 인력을 연간 1000명씩 키워내겠다”며 “국내 기술로 만든 전력산업기술기준(KEPIC)을 국제 표준으로 만들기 위해 총력을 기울일 것”이라고 말했다. KEPIC는 원자력·화력발전소, 송·배전 설비 등 전력산업 설비와 기기의 안전성, 품질을 확보하기 위해 만든 국내 전력산업계의 기술표준이다. 아랍에미리트(UAE) 원전에도 사용된 바 있다.  남북관계의 진전을 전제로 통일 이후를 대비한 북한의 전력 문제에 대해서도 언급했다. 조 사장은 “통일이 된다면 제일 시급한 문제가 북한의 전력 문제일 것”이라며 “실질적인 액션플랜인 만큼 공개는 하지 않지만 상당히 많은 연구를 축적해 왔다”고 말했다.신민기 minki@donga.com·손영일 기자[☞오늘의 동아일보][☞동아닷컴 Top기사][☞채널A 종합뉴스]   ,동아일보,2016-01-25 03:10:00
사회,[삼척]종합발전단지 3·4호기 촉구 원덕 주민유치위 내달 발족,       3일부터 서명운동 등 전개【삼척】속보=삼척시 원덕읍번영회 등 원덕지역 주민들이 종합발전단지 3·4호기 조기 건설 착수(본보 지난 14·15일자 20면 보도)를 위한 유치위원회를 오는 2월3일 발족하고 유치활동에 본격 나선다.원덕읍번영회 등 주민들에 따르면 한국남부발전(주)이 사업자인 종합발전단지 1·2호기 2,000㎿는 지난해 말부터 예비가동을 본격화하는 등 올 상반기 준공할 계획이다.하지만 2,000㎿ 용량의 3·4호기 건설이 정부의 7차 전력수급기본계획에서 배제됐다.원덕읍 주민들은 “종합발전단지 건설을 유치할 당시 3·4호기까지 건설하는 것으로 약속돼 주민들이 화력발전소 유치에 동의했다”며 “그러나 정부가 민간기업에게 사업권을 주면서 사업추진이 제대로 이뤄지지 않는 데다 사업권을 매매하는 상황에 이르고 있다”고 주장했다.특히 주민들은 종합발전단지는 국책사업 추진 시 가장 어려운 과정인 주민 동의를 시민 99.7%의 찬성으로 유치한 사업이며, 3·4호기 건설 시 이미 산업단지개발 승인을 획득한 점을 강조하고 있다. 인허가 절차를 최소화할 수 있고, 전원부지 260만㎡ 부지와 기반시설인 방파제, 연료하역부두 등 인프라 등이 구축돼 추가적인 환경 피해 없이 건설이 가능하다는 주장이다.  이에 원덕읍 번영회와 이장단협의회 등 사회단체 30여명은 이날 발족식을 갖고 종합발전단지 3·4호기가 올 하반기로 예상되는 8차 전력수급기본계획에 포함되기 위해 유치동의서 및 서명활동을 병행해 나갈 예정이다.민동선 원덕읍번영회장은 “당초 지역 주민들과의 약속을 비롯해 이미 기본 인프라를 갖춰 정부 예산이 절감되고, 민간기업의 폐해 등을 감안할 때 종합발전단지 3·4호기 조기 건설이 반드시 필요하다”며 “주민들의 의지를 모아 이를 정부에 전달하는 역할을 다할 계획”이라고 말했다. 황만진기자 hmj@kwnews.co.kr  ,강원일보,2016-01-25 00:33:00
경제,이원복이 발견한 `뉴시티` 런던,       , ,◆ 미래도시 50년 / ①  런던서 찾은 글로벌도시 경쟁력 ◆ 이원복 총장 영국 런던의 중심, 세인트 폴 대성당에서 '밀레니엄 브리지'로 템스 강을 넘어 10분 정도 남쪽으로 걸으면 테이트 모던이 나온다. 런던의 상상력은 낡고 버려진 화력발전소 터였던 이곳을 세계 최대 규모의 현대미술 갤러리로 바꿔냈다. 낙후됐던 테이트 모던 지역은 이제 런던 도시 재생의 상징으로 탈바꿈했다. 산업시대의 유물인 높이 99m 발전소 굴뚝과 외형은 그대로 보존해 둔 채 전체 7층 건물 중 3개 층을 전시 공간으로 활용 중인 테이트 모던의 한 전시실에서는 고 백남준의 작품도 만날 수 있다. 6층 카페에 올라가면 런던 전경이 한눈에 펼쳐진다. 템스 강 건너편 세인트 폴 대성당 양옆으로 신축 중인 초고층 빌딩들이 줄지어 있다. 런던 하늘을 뒤덮은 공사용 타워 크레인 숲을 보며 -여기가 런던이 맞나-라는 탄성이 터져 나왔다. 가족과 함께 새해를 보내기 위해 벨기에서 왔다는 니콜라스 듀폰 씨는 -이번이 세 번째 런던 방문인데 올 때마다 새 고층 건물이 들어서서 놀랍다-고 말했다. 도시 경쟁력이 곧 국가 경쟁력인 시대다. 미래도시의 경쟁력을 가늠하기 위해 들른 런던 시내는 거대한 공사판이었다. 도시 곳곳엔 신축 초고층 빌딩의 개관을 알리는 커밍 순(Coming soon) 안내판이 행인들의 시선을 잡아당겼다. 런던만큼 역사적 건물에 대한 스토리텔링을 잘하는 도시는 많지 않다. 하지만 그들은 도시를 방부 처리하지 않았다. 시대 흐름에 맞춰 도시는 끊임없이 변신해 간다.이원복 덕성여대 총장은 -프랑스 파리가 모든 신축 건물을 5층 이내로 제한해 역사에 묶어뒀다면 런던은 스스로를 역사에서 해방시켰다-고 평가했다. 이 총장의 표현처럼 런던은 각종 도시경쟁력지수에서 1위를 차지한다. 글로벌 기업들은 전 세계에서 런던을 비즈니스 하기에 가장 좋은 도시로 꼽고 있고 이를 반영하듯 글로벌 기업 10개 중 4개는 유럽 본사를 런던에 두고 있다. 산업화 시대의 종언과 함께 1971년 한때 70%까지 치솟았던 런던의 실업률은 지난해 6.2%까지 떨어졌다. 전 세계에서 사람과 돈이 몰리면서 최근 1년간 런던의 평균 부동산 가격은 하루에 120파운드(약 21만원)씩 상승했다. 3.3㎡에 5억원을 넘는 아파트도 등장했다. 런던은 전통적으로 10년 이상 장기 계약이 많지만 오피스 공실률은 4.6%에 불과하다.  '철의 여인' 마거릿 대처 전 총리의 과감한 노동개혁과 금융위기 이후 긴축재정, 미래 지식산업에 대한 집중적인 투자, 외국기업에 우호적인 기업 환경이 이뤄낸 결과다. 글로벌 종합 부동산회사 세빌스의 라시드 하산 매니저는 -런던은 뉴욕, 샌프란시스코와 함께 세계 3대 스타트업 기업 유치 도시-라면서 -임대료가 상대적으로 저렴한 런던 동부 지역을 중심으로  2700개 이상의 정보기술(IT) 스타트업 기업이 런던의 경제를 끌어가고 있다-고 말했다. 　런던~옥스퍼드~케임브리지로 이어지는 골든 트라이앵글에는 생명과학 분야 특화 단지가 조성돼 미래를 준비 중이다. 런던시의 홍보기관인 런던&파트너스의 다발 고어 아시아·태평양 지역 헤드매니저는 -런던에만 120개 생명과학회사가 있고 케임브리지에 180개, 옥스퍼드에 65개가 밀집하면서 시너지 효과를 내고 있다-고 설명했다.  　런던의 속살은 아스팔트 땅 아래 지하철역에서도 들여다볼 수 있다. 대도시 지하철역 광고판은 대중의 삶을 반영하는 사회의 거울이다. 런던 지하철역에는 라이언 킹, 오페라의 유령, 위키드 등 뮤지컬, 쇼, 박물관, 전시회 광고로 가득 차 있다. 도시 삶의 즐거움을 엿볼 수 있는 단면이다. 성형외과 광고가 즐비한 서울의 지하철역이 잠시 떠올랐다. 　지난해 일본 모리연구재단이 발표한 '2015 모리지수'에 따르면 런던은 박물관 수 1위, 외국인 관광객 수 1위, 외국인 거주자 수에서 2위를 차지하는 등 '문화 교류'에서 최상위권을 차지했다. 런던이 사람을 끌어들이는 거대한 자석, '피플 마그넷(People Magnet)'이 된 비결이다. 도시 경쟁력은 아스팔트나 콘크리트가 아닌 그 속에 사는 '사람'들의 경쟁력이다. 또 세계 각국의 도시를 옮겨다니는 '도시 노매드'를 끌어당기는 힘이 런던의 도시 경쟁력이다. 런던 거리에서는 토박이 런더너(Londoner)를 만나기가 쉽지 않다. 이미 런던 거주자 중 45%는 해외에서 태어난 사람들이다. 또 한 해 런던인의 2배에 달하는 관광객이 각국에서 런던으로 몰려온다. 런던의 공기를 떠다니는 외국어는 200개가 넘는다. 이 총장은 -런던에서는 전통과 미래, 전 세계에서 모인 사람들이 제각각 색깔을 내지만 전체적으로 런던이라는 모자이크 안에 들어가 있다-면서 -외국인을 껴안는 포용력과 개방성, 역사와 규제에 얽매이지 않는 창의력과 융통성이 오늘의 런던을 만들었다-고 진단했다.[기획취재팀 = 김기정 팀장 / 김태성 기자 / 임영신 기자 / 신수현 기자 / 김현아 명예기자(건설산업연구원 건설경제연구실장)][ⓒ 매일경제 & mk.co.kr, 무단전재 및 재배포 금지] , ,매일경제,2016-01-24 18:31:00
