category,title,content_text,news_name,creatrion_time
IT,삼성물산, 잠재손실 반영하고도 작년 흑자…리스크 털고 새출발,       제일모직과 삼성물산이 결합한 통합 삼성물산이 건설·상사 부문 잠재손실을 털어내고 새출발 한다.삼성물산은 지난해 4분기 매출액 7조2211억원, 영업손실 891억원을 기록했다고 28일 공시했다. 당기순손실은 1617억원으로 집계됐다.지난해 연간 기준으로는 매출 13조3446억원, 영업이익 371억원, 당기순이익 2조6856억원을 기록했다. 구 삼성물산을 재평가해 우발부채와 자산가치 하락 등 총 2조6000억원 규모 잠재손실을 실적에 반영했다. 잠재손실 반영을 미루다가 수조원대 적자를 기록한 타업종 사례와 달리 불확실성을 제거하고 통합 법인으로 새출발하기 위한 경영진의 의지가 반영됐다고 회사 측은 설명했다.잠재손실 규모는 건설부문이 1조6000억원, 상사부문이 1조원이다. 호주 로이힐 마이닝 건설사업과 카자흐스탄 발하쉬 발전소 프로젝트 예상손실과 우발부채가 각각 8500억원, 1500억원이다. 로이힐 마이닝 건설사업은 호주 서부 필바라 지역에 조성하는 총 58억5000만달러 규모 철광석 광산과 인프라 건설사업이다. 지난해 12월 첫 선적은 했으나 지금은 공기 지연에 따른 지체보상금 협상을 진행 중이다. 카자흐스탄 발하쉬 발전사업은 발하쉬 호수 인근 지역에 1320메가와트(㎿)급 석탄화력발전소를 건설하고 운영하는 사업이다.카자흐스탄 첫 외자 유치 민자발전(IPP)사업이지만 현재 금융조달 협상 등으로 인해 공사 수행이 일시 중단됐다. 삼성물산은 이번 결산에서 유가 하락에 따른 유전자산 가치 감소분 5600억원, 기타 프로젝트 관련 지급보증과 지체보상 우발부채 4500억원 등도 반영했다.삼성물산 서초 사옥과 캐나다 온타리오 사업권, 부동산 등의 가치는 1조1000억원 가량 증가했다. 잠재손실 반영에도 불구하고 새롭게 편입된 바이오사업 평가이익이 실적에 잡히면서 연간 영업이익은 흑자를 달성했다.최호 전기전력 전문기자 snoop@etnews.com [Copyright ⓒ 전자신문 & 전자신문인터넷, 무단전재 및 재배포 금지],전자신문,2016-01-28 16:06:00
경제,삼성물산, 해외 손실 털며 4분기 적자..."불확실성 해소" 자평불구 합병시너지는 여전히 불투명,       , ,지난해 9월 삼성물산과 제일모직을 합병해 출범한 통합 삼성물산이 해외사업 손실 등을 반영하면서 4분기 영업적자로 돌아섰다. 건설과 패션, 식음료, 리조트, 바이오 부문을 합쳐 시너지를 내고, 오는 2020년 매출 60조원을 달성해 명실상부한 글로벌 기업으로 발돋움하겠다고 선언했지만 합병 첫해 성적은 기대에 못 미쳤다. 삼성물산은 2015년 4분기 연결 기준 영업실적을 잠정 집계한 결과 매출액 7조2211억원, 영업손실 891억원, 당기순손실 1617억원을 기록했다고 28일 공시했다. 9월 합병 후 10월 발표한 3분기 실적에서는 상사와 리조트·건설 부문의 선전에 힘입어 영업흑자를 냈지만 4분기 건설과 상사 부문에서 손실이 나 적자로 전환한 것이다. 연간 실적은 매출 13조3447억원, 영업익 371억원, 순익 2조6857억원을 냈다. 2조6000여억원의 당기순이익을 거둔 것은 바이오 사업 덕분이다. 합병으로 바이오 사업조직이 한 울타리로 들어오면서 자회사인 삼성바이오로직스(지분 51%)와 손자회사인 삼성바이오에피스(지분 91.2%)의 평가 이익이 반영된 데다 서초동 사옥 가격 상승과 캐나다 온타리오 신재생 발전사업 수익이 합쳐지면서 순익이 늘어났다.  4분기 적자전환은 그동안 해외건설과 상사 부문에서 쌓인 손실을 털어냈기 때문이다. 먼저 호주 로이힐 철광석 프로젝트 관련 8500억원의 손실을 반영했다. 삼성물산은 작년 9월 철광석 광산 개발사업과 철도 인프라 공사를 마무리하고 첫 선적 기한을 지켜야 했지만 20년 만에 내린 폭우 등으로 공사가 지연되면서 12월에야 첫 선적을 해 발주처에 지체상금과 추가공사비를 물어야 했다. 또 카자흐스탄 발하시 호수 인근에 1320㎿급 석탄화력발전소를 짓고 운영하는 프로젝트를 진행하는 와중에 발주처 요청으로 사업이 잠정 중단돼 1500억원의 손실을 입었다.  아울러 상사부문이 보유하고 있는 유전자산도 국제 유가 급락으로 가치가 떨어지면서 5600억원의 손실을 미리 반영했다. 다른 프로젝트 관련 지급보증과 우발부채 등 4500억원도 손실 처리했다. 이에 따라 건설에서 1조6000억원, 상사 1조원 등 총 2조6000억원의 영업손실을 반영했다.  삼성물산은 작년 손실을 미리 털고 올해 합병 시너지를 발휘해 영업흑자로 전환한다는 구상이다. 하지만 아직 합병 시너지를 낼 만한 구체적인 사업방안과 계획을 내놓지 못하는 상황이라 회사의 성장 가능성은 불투명하다는 분석이 나오고 있다. 합병에 따른 인력 구조조정이 계속 이뤄지는 데다 건설부문 3100여 명은 오는 3월 서초동에서 판교 이전을 앞두고 있어 내부 분위기도 어수선한 상황이다. 삼성물산 관계자는 -통합 삼성물산은 구 삼성물산을 재평가해 잠재손실을 작년 실적에 모두 반영하는 동시에 미래 불확실성을 제거한 것-이라며 -전체 사업부문의 통합 시너지를 찾기 위해 노력하고 있다-고 말했다. 허우영기자 yenny@dt.co.kr[네이버 뉴스스탠드에서 디지털타임스 구독 하세요]< Copyrights ⓒ 디지털타임스 & dt.co.kr, 무단 전재 및 재배포 금지 > 허우영,NULL,NULL
,NULL,NULL,NULL,NULL
 yenny@,NULL,NULL,NULL,NULL
,NULL,NULL,NULL,NULL
 , ,디지털타임스,2016-01-28 16:03:00,NULL,NULL
경제,삼성물산 잠재손실 반영하고도 흑자…리스크 해소(종합2보),         <<연합뉴스자료사진>> 옛 삼성물산 호주·카자흐 사업 등 잠재손실 2조6천억원 결산바이오 평가이익으로 순이익 달성…올해 매출 33조원 목표로 새출발    (서울=연합뉴스) 박대한 기자 = 옛 제일모직과 옛 삼성물산이 결합해 출범한 통합 삼성물산이 건설 및 상사 부문의 잠재손실을 실적에 반영하고도 연간으로는 흑자를 달성했다.    통합 삼성물산은 지난해 4분기 매출액 7조2천211억원에 영업손실 891억원을 기록했다고 28일 공시했다.    당기순손실은 1천617억원으로 집계됐다.    삼성물산은 지난해 연간으로는 매출 13조3천446억원과 영업이익 371억원을 기록했다.     삼성물산의 4분기 실적은 지난해 9월 1일 옛 제일모직과 옛 삼성물산의 합병 이후 두 번째 나온 분기 실적이다.    건설부문은 4분기 3조160억원의 매출을 올렸지만 1천500억원의 영업손실을 기록했다.    빌딩 부문의 매출 증가에도 불구하고 해외 대형 프로젝트 준공이 임박하면서 전체 매출은 감소했다. 해외 프로젝트(PJT) 손익 차질에 따른 매출이익 감소 등으로 인해 3분기에 이어 분기 적자가 이어졌다.    상사부문의 4분기 매출과 영업이익은 2조5천960억원과 280억원으로 집계됐다.    원자재 시황 악화로 주요 품목의 물량과 단가가 감소하면서 전분기 대비 매출과 이익이 모두 줄었다.    패션부문은 5천340억원의 매출과 150억원의 영업이익을, 리조트·건설부문은 1조750억원의 매출과 180억원의 영업이익을 각각 기록했다.    패션부문은 계절적 성수기 영향으로 전분기 대비 매출과 이익이 모두 늘었지만 리조트·건설부문은 리조트 사업이 비성수기인 탓에 이익이 줄었다.    통합 삼성물산은 합병 당시 리조트·건설부문, 패션사업부문, 상사부문, 건설부문 등 4개 사업부문별 체제로 운영되다가 연말 조직개편을 통해 리조트·건설부문의 건설사업을 옛 삼성물산 건설부문으로 이관했다.    삼성물산은 지난해 연간으로는 매출 13조3천446억원, 영업이익 371억원, 당기순이익 2조6천856억원을 기록했다.    연간 실적에는 옛 제일모직의 연간 실적과 옛 삼성물산의 9∼12월 실적이 포함됐다.    삼성물산은 특히 연간 실적을 결산하면서 옛 삼성물산을 재평가해 우발부채와 자산가치 하락 등 총 2조6천억원 규모의 잠재손실을 실적에 반영했다.    조선업 등이 잠재손실 반영을 미루다가 사상 최대인 수조원대 적자를 기록한 것과 달리 미래 불확실성을 제거하고 통합 법인으로 새출발하기 위한 경영진의 의지가 반영됐다.    잠재손실 규모는 건설부문이 1조6천억원, 상사부문이 1조원 규모다.    호주 로이힐 마이닝 건설사업 및 카자흐스탄 발하쉬 발전소 프로젝트의 예상손실과 우발부채가 각각 8천500억원과 1천500억원이 반영됐다.    로이힐 마이닝 건설사업은 호주 서부 필바라 지역에 인프라를 건설하는 사업으로 계약규모는 56억 호주달러에 달한다.    1분기 내 완공을 목표로 현재 잔여공사를 진행 중이나 발주처 클레임(EOT), 공기 지연에 따른 지체 상금(L/D) 등의 사안을 놓고 협상이 진행되고 있다.    카자흐스탄 발하쉬 발전사업은 발하쉬 호수 인근 지역에 1천320메가와트(MW)급 석탄화력발전소를 건설하고 운영하는 사업이다.    카자흐스탄 최초의 외자 유치 민자발전(IPP)사업이지만 현재 금융조달 협상 등으로 인해 공사 수행이 일시적으로 중단됐다.    삼성물산은 이번 결산에서 유가 하락에 따른 유전자산의 가치 감소 5천600억원, 기타 프로젝트 관련 지급보증 및 지체상금 우발부채 4천500억원 등도 반영했다.    반면 옛 삼성물산 사옥과 캐나다 온타리오 사업권, 부동산 등의 가치는 1조1천억원 가량 증가한 것으로 평가됐다.    통합 삼성물산은 이같은 대규모 잠재손실 반영에도 불구하고 합병 과정에서 바이오 사업 등의 평가이익이 실적에 반영되면서 연간으로는 당기순이익이 3조원에 유박했다.    삼성물산 관계자는 -옛 삼성물산의 잠재손실을 모두 털어낸 것은 미래 불확실성을 제거하고 새 출발 의지를 다지기 위한 것-이라고 설명했다.    한편 삼성물산은 이날 보통주 1주당 500원, 종류주 1주당 550원을 현금배당하기로 결정했다. 배당금 총액은 839억원 규모다.    삼성물산은 올해 매출 전망치로 33조169억원을 제시했다.    pdhis959@yna.co.kr▶ [현장영상] '응답하라 샤킬 오닐' 동네 아이들과 농구 한 판▶ [오늘의 핫 화보] 발사 73초 만에 폭발한 챌린저호 '비극' 30주년,연합뉴스,2016-01-28 16:00:00
경제,통합 삼성물산, 구 삼성물산 잠재손실 결산 반영, 영업이익 371억원,       [스포츠서울 박시정기자] 삼성물산은 2015년도 결산에서 구(舊) 삼성물산을 재평가해 우발부채와 자산가치 하락 등 총 2조6000억원 규모의 잠재손실을 실적에 반영했다고 28일 밝혔다.삼성물산은 구 삼성물산의 호주 로이힐 마이닝 건설사업의 예상손실 8500억원과 카자흐스탄 발하쉬 발전소 프로젝트의 우발부채 1500억원을 잠재손실로 반영했다. 유가하락에 따른 유전자산의 가치 감소 5600억원, 기타 프로젝트 관련 지급보증 및 지체상금 우발부채 4500억원도 잠재손실로 처리했다. 사업 별로는 건설부문 잠재손실 처리 액수는 1조6000억원, 상사부문은 1조원 규모다.반면 구 삼성물산 사옥과 캐나다 온타리오 사업권, 부동산 등의 가치는 약 1조1000억원 가량 증가한 것으로 평가됐다.이로써 통합 삼성물산은 2015년 연간 매출 13조3446억원, 영업이익 371억원, 당기순이익 2조6856억원을 기록했다. 대규모 잠재손실 반영에도 불구하고 합병 과정에서 바이오 사업 등 평가이익이 반영된 결과다. 통합 삼성물산은 구 삼성물산의 잠재손실을 모두 털어내 미래 불확실성을 제거했다.호주 로이힐 마이닝 인프라 건설사업은 호주 서부 필바라 지역 철광석 광산 개발 사업 중 플랜트와 철도, 항만 등 인프라를 건설하는 사업으로 계약 규모는 총 56억 호주달러에 달한다. 1분기 내 완공을 목표로 현재 잔여공사 진행 중이며 발주처 클레임, 공기지연에 따른 지체 상금 등을 놓고 협상을 진행하고 있다.캐나다 온타리오 신재생 발전사업은 1369MW급 풍력·태양광 발전 단지를 조성하는 사업이다. 약 50억달러 규모의 사업이 총 3단계로 나눠 진행되고 있다. 현재 1,2단계 중 풍력 689MW, 태양광 100MW 발전단지가 완공돼 운영되고 있다.카자흐스탄 발하쉬 발전사업은 1320MW급 석탄화력발전소를 건설해 운영하는 사업으로 카자흐스탄 최초의 외자 유치 민자발전 사업이다. 현재 발주처 요청으로 공사 수행이 일시적으로 중단된 상황이다.  charlie@sportsseoul.com▶'만화관 대확장' 무료만화 보러가기 ▶[포토/영상] [페이스북] [뉴스스탠드]  [기사제보 news@sportsseoul.com]   Copyright ⓒ 스포츠서울&sportsseoul.com , ,스포츠서울,2016-01-28 15:48:00
경제,삼성물산 "호주 로이힐 프로젝트 약 5000억원 적자",       , ,[머니투데이 배규민 기자] [총 1조6000억 손실 반영…사우디 쿠라야, 카자흐스탄 발전소 수천억원대]삼성물산 건설이 진행 중인 사업장에서 예상 손실액이 1조6000억원에 달하는 것으로 나타났다. 해외에서의 공사 지연과 중단 등이 주요 원인이다.  삼성물산은 28일 연결재무제표 기준 지난해 4분기 영업 잠정 실적 발표를 통해 이같이 밝혔다. 지난해 기준으로 호주 로이힐 프로젝트에 대한 예상 손실액은 8500억원으로 책정됐다. 삼성물산 관계자는 -지난해 3분기 1500억원 손실액도 반영된 수치-라면서 -2014년부터 공사해서 벌어 들인 영업이익(3730억원)을 반영해도 총 4770억원의 적자를 보게 된다-고 설명했다. 총 사업 규모가 56억 호주달러에 달하는 로이힐 프로젝트는 지난달 30일이 준공 예정일이었지만 아직 공사가 진행 중이다. 삼성물산측은 -1분기 내 완공을 목표로 하고 있다-며 -발주처의 클레임과 공기 지연에 따른 지체 보상금을 놓고 협의를 진행 중-이라고 밝혔다. 발주처는 공사 지연 등을 이유로 지난 14일 1800억원 규모의 본드콜(계약이행보증금 회수)을 신청하기도 했다. 삼성물산 측은 -보수적으로 잠재 손실액을 모두 반영했다-며 -추가 손실은 없을 것으로 본다-고 기대했다.카자흐스탄 발하쉬 화력발전소 공사 중단도 발목을 잡았다. 2조8000억원 규모에 달하는 이 공사는 지난해 9월 발주처의 요청으로 일시 중단됐다. 삼성물산과 삼성엔지니어링이 공동으로 추진키로 한지 3개월여만이다. 자금 조달 세부안을 놓고 카자흐스탄 정부와 합의점을 찾지 못한 것에 따른 것으로 재개 여부는 현재 불투명하다. 삼성물산은 카자흐스탄 발하쉬 화력발전소 공사 중단에 따른 손실을 1500억원으로 예상했다.사우디아라비아 쿠라야 사업도 보유 지분 가치 하락 등으로 1000억원이 손실 반영됐다. 지난해 3분기에는 공사 지연으로 1500억원이 손실 처리됐었다. 국내 사업장의 경우 용산국제업무지구 개발 사업 관련 토지소유권 반환 소송 1000억원 등과 여의도 파크원 공사 중단 등 악성 사업장으로 인한 비용 등이 반영됐다. 삼성물산은 2015년 결산에서 상사 사업을 포함한 구 삼성물산의 우발부채와 자산가치 하락 등 총 2조6000억원 규모의 잠재 손실을 실적에 반영했다고 밝혔다. ['생존 재테크' 백과사전 -재테크를 부탁해- ][부자들에게 배우는 성공 노하우 '줄리아 투자노트'  ][내 삶을 바꾸는 정치뉴스 'the 300'][오늘 나의 운세는? '머니투데이운세' ][아찔한 girl~ 레이싱모델 핫포토 ]배규민 기자 bkm@mt.co.kr<저작권자 ⓒ '돈이 보이는 리얼타임 뉴스' 머니투데이, 무단전재 및 재배포 금지> , ,머니투데이,2016-01-28 13:32:00
경제,삼성물산 "2.6조 잠재손실 반영…미래 불확실성 제거",       , ,지난해 9월 옛 제일모직과 합병한 통합 삼성물산이 구(舊)삼성물산의 건설 ,상사 부문 대규모 잠재손실을 실적에 반영했지만 연간으로는 흑자를 달성했다.삼성물산은 28일 실적 공시를 통해 2015년 매출 13조3446억원, 영업이익 371억원, 당기순이익 2조6856억원을 기록했다고 28일 밝혔다. 순이익 규모가 큰 것은 합병 이후 회계처리 과정에서 바이오 사업이 연결대상 종속회사로 편입되면서 발생한 처분이익이라고 회사측은 설명했다.특히 삼성물산은 이번 실적에서 옛 삼성물산을 재평가해 우발부채와 자산가치 하락 등 총 2조6000억원 규모의 잠재손실을 실적에 반영했다. 건설부문에서 1조6000억원, 상사부문에서 1조원 규모다.건설부문은 수주 당시부터 저가 입찰로 손실 우려를 샀던 '로이힐 철광 철도시설 프로젝트'에대한 예상 손실로 8500억원이 잡혔다. 이 사업은 호주 서부 필바라 지역 철광석 광산의 플랜트와 철도, 항만 등 인프라를 건설하는 총 56억호주달러 규모의 프로젝트다. 작년 4분기 준공이 목표였지만 현재 올 1분기 완공을 목표로 잔여공사를 진행중이다. 발주처 클레임(EOT)과 공기 지연에 따른 지체상금(L/D) 등 사안을 놓고 협상이 진행중이다.또 카자흐스탄 발하쉬 호수 인근에 1320MW급 석탄화력발전소를 건설하고 운영하는 사업 민자발전(IPP) 사업에서 1500억원의 우발채무가 잠재손실로 반영됐다. 이 사업은 현재 발주처 요청으로 공사가 중단된 상태다. 상사부문에서는 유가하락에 따른 유전 자산가치 감소로 5600억원, 그밖에 프로젝트와 관련한 지급보증 및 지체상금 우발부채로 4500억원을 손실로 반영했다. 삼성물산 관계자는 -재평가 과정에서 서초동 기존 삼성물산 사옥과 캐나다 온타리오 사업권 등의 가치는 약 1조1000억원 가량 증가한 것으로 나타났다-며 -잠재손실을 모두 털어 낸 만큼 미래 불확실성을 제거하고 새 출발할 것-이라고 말했다.데일리안 박민 기자ⓒ (주)데일리안 - 무단전재, 변형, 무단배포 금지 , ,데일리안,2016-01-28 12:24:00
경제,[줌인 리더스클럽 - 현대건설]글로벌 新시장 진출로 지속적 성장 ‘올인’,       중남미·阿·CIS 성장무대 중심글로벌진출로 신성장동력 마련제재 풀린 이란 수주확대 전망올 수주목표 38% 늘린 27조원현대건설이 글로벌 시장 진출 확대를 통해 신성장 동력을 마련하고, 사업구조의 고도화, 수주경쟁력 제고 등의 전략으로 지속적인 성장을 이어갈 전망이다. 특히 더욱 치열해진 건설 수주 경쟁 속에 중남미, 아프리카, 옛 독립국가연합(CIS) 등 신흥국 각국으로 활로를 모색하면서 위기를 기회로 만들어낼 계획이다.정수현 현대건설 사장.지난해는 이미 이같은 노력들이 결실을 맺는 해였다. 현대건설은 국내외 어려운 경제 여건 속에서도 견조한 실적을 기록하며 신시장 진출의 성과들을 확인했다.현대건설의 지난해 매출액은 전년도인 2014년 17조3870억원 보다 10% 가량 증가한 19조1221억원을 기록했다. 같은기간 영업이익 역시 2.9% 늘어난 9866억원으로 집계됐다. 다만 당기순이익은 0.5% 소폭 감소한 5840억원으로 나타났다.하지만 성장 흐름은 꾸준히 이어질 것으로 예상되고 있다.금융정보업체 에프엔가이드에 따르면 현대건설의 올해 매출액은 지난해보다 증가한 19조3983억원, 영업이익은 1조708억원으로 추산된다. 이는 현대건설이 목표한 연매출 19조2000억원보다 많은 것이다.내년 매출은 20조6305억원, 영업이익은 1조1637억원으로 전망된다.현대건설은 “올해에도 외형적인 성장보다는 수익성 중심의 질적 성장에 초점을 맞춰 안정적인 실적을 지속적으로 유지할 계획”이라며 “국내 재개발ㆍ재건축과 자체사업 추진 등을 비롯해 경제제재 해제 이후 주목받고 있는 이란과 인프라 중심의 대량 발주가 예상되는 아시아 지역을 중심으로 해외 시장에서 선택과 집중, 시장다변화 전략을 통해 수주를 확대할 방침”이라고 밝혔다.현대건설과 SK건설이 컨소시엄을 구성해 시공중인 터키 제3보스포러스 대교.[사진=현대건설]올해 수주 목표는 지난해보다 37.9% 증가한 27조3300억원이다.현대건설은 지난 2014년 110억 달러의 해외수주를 기록했고, 3년 연속 100억달러 이상 해외수주를 달성한 바 있다. 27개 해외지사와 연락사무소를 갖추고 있으며 전 세계 58개국에서 806개 프로젝트를 진행했다.현대건설의 성장무대가 될 것으로 예상되는 곳은 중남미와 아프리카, CIS 지역이다.중남미에선 지난 2012년 3억5000만달러 규모의 콜롬비아 베요(Bello) 하수처리장 공사 수주, 현대종합상사ㆍ한전KPS와의 컨소시엄을 통한 6억3000만달러 규모 뿐다 델 띠그레(Punta del Tigre) 복합 화력발전소 공사 수주, 2014년 칠레 차카오(Chacao) 교량공사(6억4800만달러) 등 여러차례 가시화된 성과를 일궈냈다.CIS 지역에서는 우즈베키스탄 복합화력발전소 공사(8억2000만달러, 2013년), 가스액화정제시설(GTL) 공사(32억달러, 2013년) 수주 등을 비롯, 투르크메니스탄 등 중앙아시아 전역으로의 사업영역 확대 노력을 기울이고 있다.아프리카에서는 코트디부아르 아지토(Azito) 발전소 증설 공사(2억5000만달러, 2013) 수주 등을 비롯해 우간다, 알제리 등으로도 진출을 확대, 향후 알제리 지역에서의 발전소 공사 수주도 기대되고 있다.이를 위해 현대건설은 각 핵심 사업별 캐시카우(Cash Cow) 육성, 균형있는 포트폴리오 확립 등 사업구조의 고도화와 더불어 중남미ㆍ아프리카 등 신시장에 능통한 전문가 육성과 같은 수주 경쟁력 등을 해외사업 추진 전략으로 삼고 있다. 특히 이란의 경제제재 해제 이후 이란 시장에서의 대규모 인프라 및 플랜트 공사 발주가 예상돼 최근 이란 테헤란에 지사를 설립하고 수주에 전력할 계획인 것으로 전해졌다.문영규 기자/ygmoon@heraldcorp.com겨드랑이, 착색된 피부톤 밝게 하려면..김현주 이미연 냉부 등...215억원에 중국 자본 품으로[글로벌 인재들의 필수 역량, SKEC 영어글쓰기대회] [주니어 영어 신문의 가장 효율적인 학습 서비스][헤럴드경제] [SUPERICH] [REAL FOODS] [헤럴드증권방송] [HOOC]- Copyrights ⓒ 헤럴드경제 & heraldbiz.com, 무단 전재 및 재배포 금지 - , ,헤럴드경제,2016-01-28 11:34:00
