category,title,content_text,news_name,creatrion_time
사회,초대석 정휘 포항경실련 집행위원장,       “혈세 지원에 문화재관람료까지 말도 안돼-보경사 문화재관람료 징수 폐지를 위한 소송 추진포스코 포항제철소 석탄화력발전소 건설에는 조건부 찬성대구-포항 간 불합리한 시외버스 노선 개선 “뿌듯”“오지랖 넓다는 말을 들으면 기분좋습니다” 포항경실련 정휘 집행위원장.포항경제정의실천시민연합(이하 포항경실련) 정휘(52ㆍ사진) 집행위원장은 경북 포항에서 ‘오지랖 넓은 한의사’로 불린다. 포항시 문화도시조성 준비위원, 포항 예술문화연구소 이사장, 멤버 수 1만7,000명의 ‘페이스북 포항’ 회장 등 이름 앞에 붙는 직함만도 손으로 헤아릴 수 없을 정도다. 또 사회복지시설 의료봉사도 소홀하지 않는다. 정 위원장은 “‘하등의사는 몸의 병을 고치고 중등의사는 마음의 병을, 상등의사는 세상의 병을 고친다’는 말이 있는데 상등의사까지 아니라도 중등의사는 돼야 할 것 같아 많은 사람들의 목소리에 귀를 기울일 뿐”이라고 말했다. 정휘 집행위원장을 만나 최근 포항경실련에서 추진 중인 보경사 요금 인상 폐지 운동과 지역 현안과 관련한 입장을 들어봤다. _포항경실련이 포항 보경사 문화재관람료 인상과 관련해 폐지를 적극 주장하고 나섰다. 이유는.“그동안 꾸준히 보경사의 문화재 관람료 징수의 부당함을 주장하다 지난해 초부터 본격적으로 포항시와 사찰측에 항의하고 시정을 요구했다. 하지만 포항시는 어떤 연유에서인지 적극 나서지 않고 보경사 측은 대꾸조차 없다. 보경사는 지금 많은 사람들이 이용하는 내연산 입구를 막고 문화재를 전혀 볼 생각이 없는 등산객이나 관광객들에게도 관람료를 받고 있다. 더구나 보경사는 문화재가 있다는 이유로 해마다 국비와 도비, 시비까지 많은 혈세를 지원 받고 있다. 올해도 11억2,500만원의 예산이 지원된다. 국민들이 낸 혈세를 받으면서 문화재 관람료를 받는 건 말이 안 된다.” _이와 관련해 소송도 준비하고 있다고 하던데.“내연산으로 들어가는 길이 사유지이며 일부 보경사 소유 땅이 있는 것으로 알고 있다. 그러나 ‘관습상의 도로라 보경사에 들어가지 않는 내연산 일반 등산객들까지 문화재 관람료를 징수하는 것은 위법 소지가 있다’는 법률 자문을 받았다. 전라도 한 사찰도 보경사처럼 길을 막고 문화재 관람료를 징수했는데 부당하다는 판결을 받은 것으로 안다. 게다가 보경사는 올해 많은 혈세를 지원받는데도 최근 문화재 관람료를 40%나 인상했다. 포항경실련도 더 이상 항의만 할 수 없어 징수 폐지를 위한 소송을 추진하기로 했다. 이와 함께 지난 5년간 보경사에 지원된 국비와 도비, 시비에 대한 자료를 포항시에 요구했다. 내역서를 받으면 철저히 조사해 부당한 지출은 민형사상의 책임을 물을 계획이다.”_평소 지역 현안에 많은 관심을 갖고 적극 나서는 편인데 특별한 이유가 있나.“사회 구성원으로서 지역 현안에 관심을 갖는 건 당연한 일이라고 생각한다. 당연한데도 많은 사람들이 당장 자신과 상관없다는 이유로 무관심하다. 그런데 아무도 관심 갖지 않으면 이 사회는 어떻게 되겠나. 수년 간 암자에서 머물면서 인생이 무엇인지, 인간이란 무엇인지 깊게 고민한 적이 있다. 그때 내린 결론이 ‘세상이 어떻게 바뀔 지는 결국 내가 어떻게 살아가느냐’에 달려 있다는 것이었다. 사람들이 ‘오지랖 넓다’고 얘기할 때마다 기분이 좋다. 개인적으로 불교의 ‘윤회설’과 기독교의 ‘천국’을 모두 믿는데 열심히 잘 살면 다음 생에 복을 받거나 천국에 갈 것이다. 후회 없는 인생을 살고 싶다.” _지난해 포스코 포항제철소 석탄화력발전소 건설 추진과 관련해 찬성 입장을 밝혔다가 지역 다른 시민단체와 환경단체에 뭇매를 맞았다. 왜 그런 주장을 했나.“정확히는 조건부 찬성이다. 포항은 포스코와 떼려야 뗄 수 없는 관계인데도 많은 시민들이 포스코 사업에 무조건 반대하는 경향이 있다. 포항제철이 들어서고 지역이 발전한 반면에 많은 피해가 발생한 것도 사실이다. 아름다운 영일만의 금빛 모래가 사라졌고 공기도 나빠졌다. 석탄화력발전소가 대기를 더 오염시킬 수 있다. 그러나 세계적인 철강 경기 침체로 포스코 사정이 좋지 않다. 기술 발전으로 공급은 늘어나는데 수요는 줄고 저가의 중국산 공세까지 겹쳐 생존의 기로에 서 있다. 하지만 포스코가 사라지면 포항은 어떻게 될까. 그렇다고 경제 논리에 환경을 포기하자는 게 아니다. 일본 요코하마 이소고(ISOGO) 화력발전시설처럼 청청 화력 설비를 바란다. 또 화력발전 시설 완공 후 환경단체와 지역민들이 함께 1년 간 시험 가동을 지켜볼 수 있도록 해 달라고 했다. 덮어놓고 반대하는 건 포항시와 포스코가 공멸하자는 것과 다름없다.”_포항경실련 활동을 하면서 보람있는 일을 꼽는다면. “대구와 포항을 잇는 고속도로가 생겼는데도 두 지역을 오가는 무정차 시외버스가 시간이 20분이나 더 걸리는 기존 노선을 고집한 적이 있다. 시외버스 관리 감독권은 경북도에 있는데 포항시가 경북도에 요구해도 고쳐지지 않았다. 포항경실련이 나섰고 주민감사 청구와 부당이득환수소송을 추진하자 시정됐다. 또 포항시가 서민의 발인 포항 시내버스에 해마다 100억원의 보조금을 지급하면서 10년간 제대로 회계 감사를 실시하지 않은 사실을 밝혀냈다. 포항경실련은 직접 감사를 벌였고 부당하게 지급된 10억여원의 혈세를 찾아냈다. 최근에는 포항 선린대 교수들의 부당해고 사실에 성명서를 발표해 전국적으로 알리고 교육과학기술부에 항의했다. 지속적으로 해고 철회를 요구한 결과 교수들은 학교로 복직하게 됐다.”_지역 현안에 목소리를 내니 나중에 선거에 출마하는 것 아닌가 하는 이야기도 있다. “언제나 많은 사람들과 함께 고민하고 함께 힘써 해결해 나가는 걸 생각한다. 스스로 힘을 키워 해결 해야겠다 생각은 해본 적 없다. 정치인은 국민들의 뜻을 잘 헤아리는 분들이 잘하면 된다. 정치인이 되지 않아도 많은 사람들과 함께 더 나은 세상을 꿈꿀 수 있고 만들 수 있다. 정치인이 올바른 정치를 하도록 시민의 한 사람으로 삶의 현장에서 나오는 목소리를 제대로 알리면 된다. 정치인의 길을 걸을 생각은 없다.- 김정혜기자 kjh@hankookilbo.com●약력대구 영진고 졸업대구한의과대학 한의학 졸업 정한의원 원장포항 예술문화 연구소 이사장포항경실련 집행위원장노인요양시설 포항 햇빛마을 주치의포항 성모장애원 마리아의 집 주치의[아직 모르시나요? 반칙없는 뉴스 바로가기] [한국일보 페이스북] [신문에는 없는 뉴스] [꿀잼 동영상][ⓒ 한국일보(hankookilbo.com), 무단 전재 및 재배포 금지] , ,한국일보,2016-01-31 20:13:00
세계,"한·중 급격한 도시화 탓 기후변화 복잡하게 나타날 것",       ‘세계적인 기후 전문가’ 케빈 트렌버스 미국 국립대기연구소 박사지구촌이 자연재해로 몸살을 앓고 있다. 인류의 무분별한 개발과 소비가 초래한 ‘지구의 역습’이다. 자연재해는 인류의 지속적인 개발행위로 지구의 자동조절장치가 고장 나면서 발생하는 현상이다. 세계는 환경 재앙의 위기 속에서 지난해 12월 12일 ‘파리 기후협정’에 가까스로 합의했다. 세계 최고의 기후·기상 전문가로 인정받는 미국 국립대기연구소(NCAR) 선임과학자인 케빈 트렌버스 박사는 창간 27주년을 맞는 세계일보와의 전화 인터뷰에서 파리협정을 긍정적으로 평가하면서도 한계점을 지적했다. 콜로라도주에 위치한 NCAR 연구소에 머물고 있는 트렌버스 박사는 “파리협정으로 에너지 산업의 패러다임을 바꾸는 변곡점이 마련됐다”면서도 “구체적인 실천 방안의 부재는 과학자의 눈에는 큰 한계로 보인다”고 밝혔다.―지난해 프랑스 파리에서 열린 유엔 기후변화협약 당사국총회(COP21)에서 195개 협약 당사국은 지구 평균기온 상승폭을 2100년까지 산업화 이전 평균기온 대비 ‘최대 1.5도 이하’로 유지하자는 합의를 도출해냈다. 이 합의에 공감하지는 못한다는 것인가.“협정이 불완전한 게 사실이다. 2020년도부터 5년마다 당사국들의 탄소 감축 규정 준수 여부를 점검하기로 했는데, 강제성이 결여돼 있다. 지금부터 협정 당사국들이 노력을 펼친다고 하더라도 기온 상승 억제를 위한 인프라 구축에 20∼30년이 걸릴 것이다. 예를 들어 자동차와 화력발전소의 평균 수명은 12년과 40년인데, 그 기간만큼 새로운 협정의 내용을 적용하기가 힘들게 될 것이다.”케빈 트렌버스 미국 국립대기연구소(NCAR) 선임과학자가 “이상기후는 인류의 무분별한 개발이 초래한 현실이므로 이를 억제하기 위한 범지구적 차원의 강력한 노력이 필요하다”고 강조하고 있다.케빈 트렌버스 제공―파리협정의 가장 큰 문제는 무엇이라고 생각하는가.“기온 상승을 막을 구체적인 방법이 보이지 않는다. 각국의 탄소 감축 노력에 인센티브를 주는 등 시장 메커니즘을 도입하기로 했지만 소기의 성과가 나타날지 불확실하다. 국가별 감축기여방안(INDC) 제출에서 더 나아가 이를 이행하지 않은 나라를 제재할 방안이 마련돼야 한다. 동기 부여도 중요하지만, 실천도 그만큼 중요하다는 이야기다.”―당신은 메이저리그의 전설적인 포수였던 요기 베라의 ‘야구는 90%가 정신력’이라는 어록을 인용해 ‘기후변화의 90%는 윤리가 좌우한다’고 말해왔다.“기후변화 억제는 당장 경제적으로 이득을 주지 않는다. 하지만 장기적으로는 인류에 이득이므로, 이를 실천하는 게 중요하다. 행동을 강제하려면 과학적 증거가 필요하다고 생각한다. 또 어떻게 할 것인지, 어떤 행동을 해야 하는지도 고민해야 한다. 이런 차원에서 기후변화에 맞서기 위해서는 ‘무엇’보다는 ‘어떻게’가 중요하다는 의미였다. 어떻게 합의한 시간표대로 이행할 것인지에 대한 각성이 그만큼 절실하다.”―일반인들은 기후변화 문제를 ‘과학’보다는 ‘철학’이나 ‘가치’ 측면에서 접근하곤 한다.“맞는 말이다. 심지어 정부 관계자도 기후변화 문제를 다루는 과정에서 사실에 근거한 과학이 아닌 의견을 표명하는 경우가 많다. 미국의 많은 교과서에 설명된 기후변화 개념에도 이런 경향이 드러난다. 가령 기후변화를 설명할 때 추정적인 생각을 드러내는 조동사들(may, could 등)이 많이 활용된다. ‘결정한다’(determine), ‘발견한다’(find) 등의 단어로 과학적 증거를 제시해야 하는 글들에서마저 그렇다. 그런 측면에서 ‘인류의 활동이 기후변화의 원인이 됐을 가능성이 있다’는 등의 표현은 만족스럽지 못한 것이다. 대신 ‘인류의 활동이 지구온난화 등을 야기했다는 것은 과학적으로 확인됐다’고 해야 옳은 표현이다.”―과학적으로 검증된 기후변화의 양상을 구체적으로 설명해 달라.“인간의 행동에서 비롯된 기후변화는 자연 자체의 변화보다 100배는 빠르다. 그 변화 속도는 해가 갈수록 급격히 빨라지고 있다. 가령 지구온난화는 1970년대보다는 1980년대가, 1980년대보다는 1990년대가 더 가파른 곡선을 그리고 있다. 선진국과 개발도상국을 포함한 세계 각국에서 이뤄진 도시화의 속도가 빨라졌기 때문이다.”―이번 겨울 미국에서는 봄철 같은 이상 고온현상을 보이다가 갑자기 기록적인 폭설이 몰아쳤다.“겨울철 고온 현상과 폭설은 앞으로도 간헐적으로 반복될 것이다. 올해는 엘니뇨로 고온 현상이 나타났지만, 2014년도엔 엘니뇨의 영향 없이도 따뜻한 겨울이 계속됐다. 그렇다고 이런 현상이 해마다 반복된다고 할 수는 없다. 이상기후 현상은 계단형의 모형으로 나타난다. 몇 년간은 평범했다가 특정 해에 갑자기 이상기온을 일으킨다. 이를테면 2010년과 2015년의 세계적인 폭염, 2012년 텍사스주와 오클라호마주의 가뭄, 2003년 프랑스 인근을 덮은 폭염은 어느 때고 재연될 수 있다.”―1865년 이후 해양이 흡수한 열에너지의 절반은 최근 18년 동안 흡수된 것이라는 연구도 나왔다.“육상에서 사용한 열에너지의 93%는 바다가 흡수한다. 바다가 열에너지를 흡수하는 동안 대기 온도는 덜 상승하게 된다. 바다는 기후변화를 늦추지만 서서히 영향력을 드러낸다. 엘니뇨 현상에서 보듯 장기적으로는 바다가 수용한 열에너지는 재앙이 될 수 있다. 바다가 열을 흡수하면 해수면이 흡수하는 에너지는 적어져, 바다와 해수면의 열에너지 균형이 무너지기 때문이다. 그러면 대기나 지표에 머무는 열이 늘어나게 된다. 바다는 이상기후 현상을 막는 최후의 보루인 만큼 환경 재앙을 막기 위해서는 화석연료 등의 사용을 더욱 줄여야 한다.”―기후변화와 관련해 한국 정부나 독자들이 특별히 관심을 둬야 할 대목은 무엇인가.“기후변화는 바다보다는 육지에서 더 잘 감지된다. 보통 같은 조건이라면 육지가 바다에 비해 2배 정도 빠르게 온도가 증가한다. 더구나 도시화가 급격하게 진행된 한국이나 중국 등은 더 큰 문제를 안고 있다. 두 나라 모두 대기 오염으로 태양이 차단되고 폭우가 발생하는 등 기후변화가 복잡하게 나타날 가능성이 있다. 식별가능한 대기오염은 강우 등으로 사라질 수 있지만, 눈에 보이지 않는 물질은 그렇지 않다. 가령 이산화탄소는 보통 대기중에 일주일을 머무는데, 체류 기간이 열대우림지역에서는 짧지만 건조한 몬순기후 지역에서는 길다. 한국 정부는 이런 점에 유념해서 환경 정책을 펴나가야 한다.”―당신은 1972년 ‘나비효과(butterfly effect)’ 개념을 만들어낸 에드워드 로렌츠 박사의 애제자로 알려져 있다.“로렌츠 박사는 ‘카오스 이론’의 토대가 된 나비효과 이론을 학문적으로 설명한 대가다. 당시 나는 뉴질랜드에서 MIT로 유학온 학생이었는데, 학위논문을 작성하면서 한 달에 한 번꼴로 선생님을 만났다. 지구의 기상이변을 연구하는 것은 그분의 가르침을 따르는 길이기도 하다. 학위 취득 이후 그분의 가르침을 더 이해할 수 있었다. 명석하셨지만 부끄러움을 많이 타는 내향적 성격의 소유자였다. 2008년 돌아가실 때까지 연구에만 매진할 뿐 좀처럼 말을 섞지 않으셨다.”워싱턴=박종현 특파원 bali@segye.com■ 케빈 트렌버스 박사는미 국립대기연구소(NCAR) 선임과학자인 케빈 트렌버스 박사는 세계적인 기상·기후학자이다. 1944년 뉴질랜드에서 태어났지만, 미국으로 유학을 떠나 1972년 매사추세츠공과대학(MIT)에서 기상학 박사학위를 받았다. ‘기후변동에 관한 정부 간 협의체’(IPCC)가 내놓은 1995년과 2001년, 2007년 보고서 작성을 주도했다. 2007년 IPCC가 앨 고어 전 미국 부통령과 함께 노벨평화상을 공동수상할 당시 노벨상위원회는 트렌버스 박사의 공적을 높게 평가했다. 1999년부터 2006년까지 세계기후연구프로그램(WCRP)의 과학위원회 위원으로 참여하는 등 전 세계의 기상·기후 문제 해결 현장에서 뛰고 있다.[동영상실험]가난한 남자 vs 돈 많은 남자[별별연구] 수면 자세로 본 연인의 관계 10가지ⓒ 세상을 보는 눈, 글로벌 미디어 세계일보  ,세계일보,2016-01-31 18:40:00
경제,주말마다 현장 찾는 주형환, 이번엔 신재생업계 만나,       - 인천공항, 화력발전소 이어 태양광발전소 찾아- -신기후체제 앞두고 신재생시장 지원 확대-[세종=이데일리 최훈길 기자] 주형환 산업통상자원부 장관이 평일뿐 아니라 주말에도 현장을 찾는 행보를 이어가고 있어 눈길을 끌고 있다. 주 장관은 이번엔 신재생에너지 업계 현장을 찾아 지원책 마련을 약속했다. 주형환 장관은 31일 오후 경기도 남양주시 강북아리수정수장 태양광발전소 현장을 방문, 신재생에너지 기업인들과의 현장간담회를 열 예정이다. OCI와 코스콘이 투자해 만든 이 발전소는 2040 가구가 1년 동안 사용할 수 있는 7만344㎿h의 전기를 생산할 수 있다. 지난 13일 취임 이후 주 장관은 인천공항, 분당복합화력발전소 등 주말마다 현장 행보를 이어오고 있다. 주 장관은 이날 간담회에 앞서 밝힌 자료에서 “신기후변화체제는 신재생에너지 산업에 더 큰 시장과 기회를 제공할 것”이라며 “투자를 가로막고 있는 낡은 시장진입과 입지, 환경규제 등을 개선해 민간의 적극적인 투자를 유도하겠다”고 밝혔다. 주 장관은 “한국전력 등 전력공기업의 선도적인 공격투자로 신재생 시장에 활력을 불어넣고 연간 8000억원 규모의 재정지원을 하겠다”며 “신재생 동반진출 협의체 등을 구성해 에너지공기업과 중소중견기업의 동반 해외진출을 지원하겠다”고 강조했다.한화큐셀 남성우 사장, OCI(010060) 백우석 부회장, S에너지 홍성민 사장, 남부발전 윤종근 사장, 노상양 신재생에너지센터 소장 등은 간담회에 참석해 업계 현황과 애로사항을 전달할 예정이다. 산업부는 한전의 ‘송배전용 전기설비 이용규정’을 개정해 신재생 발전의 변전소당 최대 접속용량을 75㎿에서 100㎿로 확대할 예정이다. 또 100kW 미만 소규모 신재생발전 접속공사비를 27%(약 230만원) 인하할 계획이다. 주형환 산업통상자원부 장관이 지난 17일 오전 인천공항 수출화물 터미널과 인천공항 자유무역지역을 방문해 통관·선적 과정을 점검했다.(사진=산업부)최훈길 (choigiga@edaily.co.kr)▶ [데일리 포커스] 알면 알수록 빠져드는 경제뉴스 ▶핫 초이스 ★ 男心 저격수 `애플힙` 그녀 ＜ⓒ종합 경제정보 미디어 이데일리 - 무단전재 & 재배포 금지＞  ,이데일리,2016-01-31 11:26:00
