category,title,content_text,news_name,creatrion_time
경제,취임 2주 주형환이 찾은 곳 10곳 중 9곳이 '수출 현장',       수출 늘릴 곳 직접 골라 방문이번엔 패션그룹형지 찾아[ 김재후 / 이수빈 기자  ] 최병오 패션그룹형지 회장(왼쪽)이 26일 회사를 방문한 주형환 산업통상자원부 장관(오른쪽)과 성기학 섬유산업연합회장(영원무역 회장·왼쪽 두 번째)에게 중국 진출 현황을 설명하고 있다. 산업통상자원부 제공주형환 산업통상자원부 장관이 연일 수출 현장을 찾고 있다. 지난 13일 취임한 뒤 2주간 방문한 열 곳 중 아홉 곳이 수출 현장이다. 나머지 한 곳은 한파(寒波) 때문에 찾은 화력발전소였다. 주 장관이 수출 회복에 최우선 목표를 두고 뛴다는 평가가 나온다.주 장관은 취임식 당일 한·중 자유무역협정(FTA) 수혜가 예상되는 제약포장기계 생산회사인 흥아기연을 방문했고, 이튿날인 14일엔 중국에서 인기가 높은 한국산 유아생활용품 생산 기업인 보령메디앙스를 찾았다.일요일인 지난 17일엔 인천공항 자유무역지역과 수출화물터미널, 경제자유구역에 있는 외국투자기업인 스태츠칩팩코리아를 차례로 들렀다. 최근엔 수조원대의 기술 수출을 달성한 한미약품과 G마켓인천물류센터 등을 방문했다. 산업부 관계자는 “장관 지시로 신성장동력과 고부가가치화가 가능한 전통주력산업, 수출물류허브, 역직구허브 등을 골라 현장 방문 동선을 짜고 있다”며 “산업부 각 국·실에서 방문 기업 등을 추천하면 주 장관이 직접 방문지를 선택한다”고 설명했다.주 장관은 26일 서울 역삼동에 있는 패션그룹형지 본사를 방문했다. 패션그룹형지는 1982년 의류사업을 시작해 지금은 20개 브랜드와 전국 2100여개 매장을 운영하고 있는 회사다. 현재 중국 상하이와 항저우 등에 12개 매장을 갖고 있다. 올해엔 중국 베이징 난징 다롄에 있는 백화점에 샤트렌, 에스콰이어 등의 브랜드 매장을 25개 열기로 하는 등 해외 진출에 적극 나서고 있다.주 장관은 이날 최병오 패션그룹형지 회장에게 “섬유패션산업은 창의적인 아이디어를 바탕으로 고부가가치화할 수 있는 주력 산업”이라며 “중국과 동남아시아 등지에서 선전해 패션산업 르네상스를 일으켜 달라”고 당부했다. 최 회장은 “중국의 섬유패션 경쟁력이 아직은 우리를 못 따라오고 있다”며 “지금이 절대적 기회”라고 화답했다.김재후/이수빈 기자 hu@hankyung.com[한경닷컴 바로가기] [스내커] [한경+ 구독신청] ⓒ '성공을 부르는 습관' 한경닷컴, 무단 전재 및 재배포 금지 , ,한국경제,2016-01-26 19:04:00
IT,물 보다 싼 기름값에 뒤바뀐 급전순위…중유발전소가 다시 돈다,       발전시장에서 한동안 사라졌던 중유발전이 저유가를 기회로 다시 재진입했다. 동서발전 울산화력발전소 전경.발전(發電)시장에서 한동안 자취를 감췄던 중유(벙커C유)가 다시 등장해 액화천연가스(LNG)와 연료경쟁이 뜨겁다. 유가 하락으로 중유 경제성이 높아지면서다. 중유발전소는 수년 내 모두 문을 닫지만 산업용 연료에 이어 발전시장에서도 중유와 경쟁하게 된 LNG발전·도시가스업계는 저유가가 달갑지만은 않은 상황이다.26일 발전업계에 따르면 한국서부발전 평택기력, 한국동서발전 울산화력은 지난해 11월 가동에 들어갔다. 두 발전소 모두 중유가 주 연료다. 여름·겨울철 전력피크 때를 제외하고 중유 발전소가 가동된 것은 10여년만의 일이다.중유발전이 전력 시장에 재진입한 것은 저유가로 석유제품 가격이 크게 떨어졌기 때문이다. 우리나라 전력시장은 가장 저렴한 연료로 전력을 생산하는 발전기를 먼저 돌리는 경제급전 방식으로 운영된다.지난 수년간 급전순위는 원자력-석탄-LNG-중유순으로 굳어졌다. 하지만 최근 저유가로 상황이 바뀌었다. 지난해 11월 중유발전소 연료비원가(원/㎾h)는 전달 대비 40원가량 낮은 60원대로 떨어졌다. 열량단가는 지난해 10월 Gcal당 5만7295원에서 12월 4만7877원까지 하락했다. 이 기간 LNG 연료비원가(원/㎾h)는 88원~119원을 기록하며 큰 변화가 없었다. 열량단가는 연말 5만6809원으로 10월 대비 0.3% 증가해 급전순위에서 중유에 밀렸다.중유발전은 전력피크 때만 제한적으로 가동하기 때문에 평소 가동률은 30%에도 못미친다. 2024년 평택화력을 끝으로 모두 문을 닫을 예정이다. 하지만 최근 가격 하락으로 마지막 불꽃을 태우고 있다. 평택기력 이용률은 지난 11월부터 70~80%대 유지하고 있다. 서부발전은 오는 4월경까지 비슷한 수치를 유지할 것으로 내다봤다.그동안 비상자원으로만 활용됐던 중유발전이 기저전력까지 치고 들어온 셈이다.경쟁 연료인 LNG업계는 촉각을 곤두세우고 있다. 지난해 기준 우리나라 발전설비 용량에서 LNG 비중은 30.8%, 중유발전 비중은 4.2%에 불과하지만 전체 전력 거래량에서 중유 발전 비중은 지난해 10월 1.4%에서 12월 3.7%대로 치솟았다. 이 기간LNG발전 거래량은 21.2%에서 20.1%로 감소했다. 최근 LNG발전소 이용률이 급락한 것을 감안하면 중유 발전소 재진입으로 인한 타격이 적지 않다는 분석이다.연료용 시장에서는 SK이노베이션 울산 콤플렉스, 에쓰오일 울산 공장이 지난해 초 일찌감치 발전용 연료를 LNG에서 자체 생산한 저유황중질유(벙커C)로 전환했다. 2014년만 해도 LNG, 연료용 중유 열량 환산 기준 배럴당 가격은 비슷한 수준이었으나 최근엔 배럴당 약 30달러 이상 격차가 벌어지면서 중유가 가장 경제적 연료로 부상했다. 이로 인해 울산지역 산업용 LNG판매량은 지난해 10월 누적 기준 전년 대비 41.4% 급감했다. 전국 산업용 LNG 판매량도 같은 기간 동안 16% 줄었다.전력거래소 관계자는 “우리나라 발전설비 비중상 중유가 LNG를 제치고 주력 연료로 부상할 가능성은 없지만 최근 틈새시장에서 쏠쏠한 재미를 올리고 있다”며 “저유가가 장기간 지속된다면 일정한 비중을 차지하며 꾸준히 발전시장에 머무를 가능성이 있다”고 내다봤다.최호 전기전력 전문기자 snoop@etnews.com [Copyright ⓒ 전자신문 & 전자신문인터넷, 무단전재 및 재배포 금지],전자신문,2016-01-26 18:03:00
경제,국내 건설사들 신시장 개척, 연구개발 역량 확대, M&A 3위일체 해야 부진 탈출,       SK건설이 지난해 미국에서 수주한 천연가스 액화플랜트 조감도.  제공  SK건설[스포츠서울 박시정기자] 국내 건설사들이 활력을 찾기 위해서는 신시장 개척, 연구개발, 기업 인수 합병(M&A) 노력이 절실한 것으로 업계 관계자들은 입을 모으고 있다.지난해 국내 건설사들의 해외 수주액은 전년 대비 30%나 감소한 461억달러로 집계됐다. 2008년(476억달러) 이후 7년 만의 최저치다. 해외건설협회는 올해도 이 수준을 넘어서기가 쉽지 않을 것으로 보고 있다. 문제는 앞으로 국제유가가 더 떨어져 건설 시장이 더 위축될 것이라는 점이다. 정부도 올해 해외 수주 달성 목표액을 정하지 않았다.국내 건설사들이 지난해 국내 주택 경기 호조에 힘입어 최악의 상황을 모면했지만 실적 부진의 늪에서 근본적으로 탈출하려면 세 가지를 실행에 옮겨 성과를 내야 한다고 지적한다. 하나는 신시장 개척을 위해 더 노력해야 한다는 것이다. 달러박스였던 중동 건설 시장이 국제 유가 하락으로 침체된 상황이어서 신시장 개척이 절실하다. 다른 하나는 중국 건설사들의 추격을 따돌리고 명실상부한 글로벌 톱 수준의 건설사로 발돋움하려면 연구개발 능력을 키워야 한다는 것이다. 마지막으로 취약한 분야에 대해서는 과감한 M&A를 통해 단기간에 역량을 끌어올려야 한다고 분석한다.◇ 중동을 대체할 건설 시장은 어디?건설사들은 중동 건설 시장에서 극심한 수주 가뭄을 겪으면서 다른 지역으로 눈을 돌리고 있다. 해외건설협회의 한 관계자는 “신시장은 기업에 따라 다르지만 미국과 캐나다를 중심으로 한 북미와 브라질 베네수엘라 칠레 등 중남미는 기업들이 공통으로 주목하는 지역이다. 기업에 따라서는 아프리카 국가들도 눈여겨 보고 있다”고 밝혔다. 세계 경제의 새로운 성장동력으로 떠오른 인도와 최근 국제사회의 경제제재가 풀린 이란도 새로운 시장으로 부상하고 있다.미국과 캐나다는 셰일가스 호황으로 인해 석유화학 플랜트에 대한 발주를 늘리고 있다. 미국과 캐나다는 경제 상황이 비교적 괜찮은 지역으로 꼽힌다. 국내 건설사들이 석유화학 플랜트에 상당한 경쟁력을 갖고 있어 석탄화력발전소를 가스화력발전소로 교체하거나 액화천연가스(LNG) 터미널을 건설하는 분야에 도전해볼 만하다. 실제로 SK건설은 2014년 매그놀리아 LNG와 미국 루이지애나주에 연산 340만톤의 천연가스 액화플랜트를 짓기 위한 양해각서(MOU)를 체결했다. 지난해 13억6000만달러 규모의 본계약을 맺었다.중남미 국가들은 사회간접자본과 석유화학 플랜트는 국가 발전을 위한 필수 시설이라는 점에서 선별적으로 발주에 나서고 있다. 현대건설은 2012년 콜롬비아 베요 하수처리장 및 베네수엘라 푸에르토 라 크루즈 정유공장, 우루과이 뿐다 델 띠그레 복합 화력공사 건설사업에 진출했다. 2014년 2월엔 칠레에서 차카오 교량 공사를 수주했다. 같은해 6월엔 베네수엘라에서 48억 달러 규모의 초대형 공사를 따내기도 했다. GS건설은 2014년 베네수엘라 국영석유공사(PDVSA)가 발주한 엘 팔리토 정유공장 증설공사 총괄관리 사업을 수주하며 중남미에 진출했다. 지난해 1월 PDVSA가 발주한 26억 달러 규모의 피리탈 가스플랜트 프로젝트를 수주하기도 했다.아프리카에서도 발전 부분과 도로 등 인프라 건설 시장이 확대되고 있어 국내 건설사들이 주목하고 있다. 인도에서는 현지 업체들과 수주 경쟁을 피할 수 있는 LNG 터미널이나 고효율 발전소 수주 가능성이 있다. 고속철도 건설은 중국과 일본이 국가 차원에서 수주 경쟁을 벌이고 있어 수주하기가 쉽지만은 않은 상황이다. 이란 건설 시장도 확대될 것으로 전망된다. 한국건설산업연구원은 이란 건설 시장이 지난해 461억달러에서 올해 496억 달러, 2017년 547억 달러, 2018년 618억 달러 규모로 성장세를 이어갈 것으로 예측했다.◇ 연구개발 역량 강화와 적극적인 M&A 시도해야건설사들은 자신의 장·단점을 원점에서 재검토하고 수익성이 있는 곳에 집중할 필요가 있다. 이것 저것 다 하려다가 하나도 제대로 못하는 결과를 낳을 수 있다. 자신들의 강점을 키우기 위한 연구개발 노력도 중요하다. 지난해 해외 수주가 급감했는데도 연구개발 능력을 키운다는 소식은 들려오지 않는다. 최고경영자(CEO)가 재임기간에 성과를 내기 어려워 투자를 하지 않는 것이다. CEO 평가 항목에 연구개발 역량 강화를 넣어야 이같은 상황이 개선될 것으로 보인다.건설사들은 M&A에도 둔감하다. 국제 무대에서는 IT 업계 뿐만 아니라 건설 업계에서도 M&A는 최대의 화두로 떠올랐다. 저명한 국제건설잡지 ENR도 최근 향후 5~10년 사이의 최대의 이슈로 M&A를 제시하고 있다. 연구개발만으로는 급변하는 상황에 대응하기 어려운 데다 M&A가 연구개발보다 훨씬 효율적일 수 있기 때문이다. 삼성물산이 2013년 영국의 LNG 저장탱크·인수기지 설계 전문업체인 웨소(Whessoe)를 인수했고 GS건설은 같은 해 스페인 수처리업체 이니마를 인수했다. 이후 M&A는 뚝 끊겼다. 현재의 기술력은 몇 년 내에 중국 건설사들에 따라잡힐 가능성이 큰 데 국내 건설사들은 연구개발도 M&A도 등한시하고 있는 것이다. 현재와 같은 안주로는 상황이 더욱 악화될 수 있다. charlie@sportsseoul.com▶'만화관 대확장' 무료만화 보러가기 ▶[포토/영상] [페이스북] [뉴스스탠드]  [기사제보 news@sportsseoul.com]   Copyright ⓒ 스포츠서울&sportsseoul.com , ,스포츠서울,2016-01-26 17:49:00
사회,"송도 LNG인수기지 증설하려면 안전 대책 마련돼야",       한국가스공사,  증설 지연 되자 '행정소송' 검토...이재호 연수구청장 -구민 협박-[오마이뉴스김갑봉 기자] ▲ 송도LNG인수기지 인천 송도 LNG 인수기지 모습. ⓒ <사진출처·한국가스공사>인천 연수구 송도의 액화천연가스(LNG) 저장탱크 증설 논란이 결국 행정소송으로 이어질 전망이다. 한국가스공사는 주민들의 반발과 연수구의 불허로 증설공사가 지연되자, 손해배상 청구와 행정소송을 검토하기로 했다.지난 2013년 4월, 산업통상자원부(아래 산업부)는 국내 천연가스 저장비율을 2012년 11%에서 2027년 21%까지 높이기 위해 LNG 저장탱크를 증설하겠다고 발표했다. 송도 LNG인수기지 증설은 이 계획에 따라 LNG인수기지 4지구를 건설하는 것이다. 연수구 송도동 348번지 일원(25만 5353.4㎡)에 20만 킬로리터 규모의 LNG 저장탱크 3기와 기화송출설비, 변전소 등을 건설할 계획이다.정부와 가스공사는 1992년 송도 LNG인수기지를 건설할 때, 10만 킬로리터 규모의 LNG 저장탱크 3기만을 건설하기로 약속했다. 하지만 현재 '10만 킬로리터'급 탱크 10기, '14만 킬로리터'급 탱크 2기, '20만 킬로리터'급 탱크 8기를 운영 중이다. 여기에 20만 킬로리터 규모의 탱크 3기를 추가하는 것이다.정부의 이러한 발표 후, 연수구 주민들은 반발했다. 특히 송도국제도시 주민들의 반발이 거셌다. 송도 LNG인수기지는 당초 송도국제도시와 18km 떨어진 해상에 있었지만, 지금의 거리는 2km에 불과하다. 게다가 2005년에 발생한 저장탱크 가스누출사건이 뒤늦게 알려지면서 주민들의 불안은 더욱 가중됐다.이 때문에 LNG인수기지 증설 논란은 2014년 지방선거 때 쟁점으로 부각했다. 유정복 인천시장은 당시 '합리적으로 해결하겠다'고 밝혔다. 하지만 인천시도시계획위원회는 2014년 8월 'LNG생산(=인수)기지 4지구 건설 사업을 위한 개발행위(토지 형질 변경) 허가 안'을 조건부 가결했다. 연수구민은 허탈할 수밖에 없었다.인천시도시계획위는 ▲ 기존 안전성 평가 용역 결과보다 강화된 안전기준 적용 ▲ 도시가스사업법에 따른 LNG생산기지 주변지역에 대한 충분한 보상 지원 ▲ 지역주민 의견수렴 등을 승인 조건으로 제시했다.그 뒤 공은 허가권을 가진 연수구로 넘어갔다. 연수구는 2010년 정말진단 결과 안전 미비 사항 57건이 발견되는 등 주민 불안이 해소되지 않았다며 ▲ 안전 확보 대책 수립 ▲ 기지 주변지역 지원법 제정 ▲ 지역주민 불안 해소 등의 조치를 선행해야 증설할 수 있다는 입장을 밝혔다.가스공사, 행정소송 등 검토인천시도시계획위가 개발행위 허가 안을 조건부 가결하자, 가스공사는 절차에 따라 주민설명회 개최를 수차례 시도했다. 지난 12일 연수구청에서 열려고 한 주민설명회까지, 그동안 모두 다섯 차례 시도했다.하지만 3차 설명회만 간신히 열렸고, 나머지는 주민 반대로 개회하지 못했다. 5차 설명회는 전과 달리 연수구가 나섰지만, 송도 주민들이 거세게 반발해 무산됐다.이에 가스공사는 착공 지연에 따른 손해배상 청구와 행정심판·행정소송을 검토하기로 한 것이다. 가스공사 인천생산본부는 -연수구가 착공 서류를 수용하지 않을 경우 법적으로 대응하겠다-고 지난 19일 밝혔다.가스공사는 다음 주를 마지노선으로 보고 있다. 우선 이재호 연수구청장과 최종 면담을 신청하고, 그 결과에 따라 대응한다는 게 가스공사의 방침이다. 연수구가 허가를 거부할 경우, 인천시에 행정심판을 청구하고, 경우에 따라서는 행정소송까지 진행하겠다는 입장이다.가스공사는 LNG인수기지 증설에 수반되는 변전실공기압축기실·부취탈취실·망루 등 시설 4개의 건축허가 신청서, 기화송출설비·파이프랙 등 공작물 2개의 축조 신고서를 연수구에 여러 차례 제출했다.하지만 연수구는 '주민의견 수렴이 부족하다'며 반려했다. 행정심판 청구 시, 연수구의 반려 처분이 타당했느냐가 쟁점이 될 전망이다.연수구청장 -조건 충족해야 허가-가스공사는 연수구를 상대로 행정소송과 손해배상 청구도 검토하고 있는데, 이는 인천시행정심판위원회에서 행정심판 청구를 기각할 시 법정에서 다투겠다는 의지로 풀이된다.가스공사는 지난해 시공사들과 모든 계약을 완료했다. 시공사인 GS건설과 금호건설은 지난해 인천사무소를 꾸리고 각각 본사 직원 14명과 9명을 파견했다. 하지만 증설공사 착공이 지연되면서 인건비와 사무실 운영비만 투입되고 있는 실정이다.시공사가 가스공사를 상대로 계약 위반과 공사 지연에 따른 손실금 보전을 청구하면, 가스공사는 연수구를 상대로 소송한다는 것이다.가스공사의 이 같은 행보에 대해 이재호 연수구청장은 '소송은 공사의 권리지만, 사실상 연수구민에 대한 협박으로 느낀다'고 말했다.이재호 구청장은 -국책사업이라고 이렇게 밀어붙일 거면 뭣 하러 기초단체를 두냐-고 비판한 뒤, -행정기관을 상대로 한 소송은 누구든지 할 수 있다, 소송은 소송대로 진행하면 된다, 반면 연수구는 연수구민의 입장을 대변할 책임이 있다-고 밝혔다. 이어 -2014년 인천시도시계획위의 조건부 승인 후 달라진 게 있냐? 없다-라며 인천시도시계획위가 내건 조건을 충족하기 전까지 허가할 수 없다는 입장을 밝혔다.'4.13 총선서 연수구 최대 쟁점' 전망 ▲ 연수구 한국가스공사가 지난 12일 연수구청에서 열기로 한 제5차 설명회는 증설을 반대하는 주민들의 반발로 무산됐다. 증설를 반대하는 주민과 토론회를 열자는 주민들이 각자 주장을 하고 있다. ⓒ 김갑봉송도 LNG인수기지에 '20만 킬로리터'급 저장탱크 3기가 증설되면 LNG 저장 규모는 기존 288만 킬로리터에서 348만 킬로리터로 는다. 이는 세계 최대 규모다.송도 LNG기지에서 인천과 '서울·경기'에 송출하는 LNG 양은 연간(2013년 기준) 각각 881만6000톤(62.7%)과 525만5000톤(37.7%)이다. 그리고 인천에 송출한 LNG 양의 86%는 화력발전소의 발전용이다.즉, 인천시민이 사용하는 LNG는 123만 4240톤으로 전체 송출량의 8.8%에 불과하다. 게다가 인천에서 생산한 전기 중 약 20%만이 인천에서 사용된다. 위험시설 집중에 따른 주민 불안은 커지지만, 지원은 미미하다. '인천은 찬밥신세'라는 말이 나오는 이유다.송도 LNG인수기지 증설은 수도권매립지 사용기간 연장, 영흥 화력발전소 증설과 함께 정부의 대표적인 '인천 홀대 정책'으로 꼽힌다. 이 때문에 2014년 지방선거 이전부터 논란이 그치질 않았다.송도 LNG인수기지 증설은 20대 총선에서 연수구의 최대 쟁점이 될 가능성이 높다. 연수구는 이번 총선 때부터 선거구가 둘로 나눠질 것으로 예상되는데, LNG 인수기지와 인접한 송도국제도시 쪽 후보자들의 입장이 표심에 상당한 영향을 미칠 것으로 예상된다.한편, 송도 LNG인수기지 증설을 둘러싼 주민단체 간 갈등도 심상치 않다. 5차 주민설명회를 무산시킨 송도국제도시주민연합회는 '인천시장, 연수구청장, 가스공사, 주민대표'로 4자 협의체를 구성할 것을 요구하고 있다.반면, 송도국제도시총연합회·국제도시송도입주자연합회·송도국제도시발전협의회 등은 송도국제도시주민연합회와 입장을 달리했다. 이들은 4자 협의체 구성은 송도 전체 주민의 의견이 아니고, 주민설명회 개최를 저지하는 것은 다른 주민들의 의사 표시를 침해하는 것이라고 했다.이들은 지난 21일 오후 송도컨벤시아에서 LNG 인수기지 증설 관련 토론회를 따로 열었다. 이들은 LNG 저장탱크를 증설하는 과정에서 가스공사가 우선적으로 해야 할 일은 '주민들이 느끼고 있는 불안감을 해소하는 것'이라고 강조했다.이 3개 단체는 사실상 '조건부 승인'에 무게를 두고 있다. 박한준 국제도시송도입주자연합회 회장은 -판례를 찾아보니, 법적으로 (증설을) 막을 수 없다는 게 중론이다-라며 -그렇다면 반대만 해서 될 일이 아니다, 가장 중요한 것은 주민들의 안전이다-라고 밝혔다. 이어 -이 문제를 정략적으로 이용해서는 안 될 것이다-라고 덧붙였다. 저작권자(c) 오마이뉴스(시민기자), 무단 전재 및 재배포 금지덧붙이는 글  이 기사는 <시사인천>에도 실렸습니다. <오마이뉴스>는 직접 작성한 글에 한해 중복 게재를 허용하고 있습니다.이 기사를 응원하는 방법!☞ 자발적 유료 구독 [10만인클럽]모바일로 즐기는 오마이뉴스!☞ 모바일 앱 [아이폰] [안드로이드]☞ 공식 SNS [페이스북] [트위터] , ,오마이뉴스,2016-01-26 15:36:00
경제,한국중부발전, 제7대 정창길 사장 취임…발전 현장에서 취임식 갖고 근무자 격려,       , ,[헤럴드경제=황해창 기자] 한국중부발전(주)은 26일 중부발전 보령화력본부 강당에서 임직원 300여 명이 자리한 가운데 제7대 정창길 사장의 취임식을 가졌다.중부발전 출신으로는 처음으로 사장직을 맡게 된 정 사장은 1951년 경남 합천 출생이며, 진주고(70년)와 고려대 행정학과(78년)를 나와 한국전력공사에 입사(78년)해 이후 2012년 중부발전 관리본부장으로 퇴직했다. [사진제공=한국중부발전]정 사장은 취임사를 통해 “누구보다 중부발전을 잘 아는 사람으로서 다시 인연을 맺게 된 것에 감사하며, 소통과 열린 경영으로, 경영평가에서 우수성적을 거두고 국민으로부터 인정받아 발전회사의 중심에 한국중부발전을 자리하게끔 하겠다”고 포부를 밝혔다. 정 사장은 또 “급변하는 경영여건을 직시해 노사가 한 마음으로 지혜를 모으고, 변화 관리와 안전을 신념으로 삼아 에너지 신산업 분야의 리더로서 국민의 삶을 바꾸는 기업이 되는 데 힘써 줄 것”을 당부했다. 김 사장은 이날 ▷기본 중시 ▷성장 추구 ▷열린 경영을 경영방침으로 정하고, 슬로건으로는 ‘한마음으로 더 좋은 미래를 열어가는 중부가족’을 내세웠다.한편,이번 정 사장의 취임식은 보령 본사 신사옥이 아닌 발전현장(보령화력발전소)에서 열려 소통과 현장중심 경영을 펼치겠다는 신임 사장으로서 의지를 표현했다. hchwang@heraldcorp.com겨드랑이, 착색된 피부톤 밝게 하려면..김현주 이미연 냉부 등...215억원에 중국 자본 품으로[글로벌 인재들의 필수 역량, SKEC 영어글쓰기대회] [주니어 영어 신문의 가장 효율적인 학습 서비스][헤럴드경제] [SUPERICH] [REAL FOODS] [헤럴드증권방송] [HOOC]- Copyrights ⓒ 헤럴드경제 & heraldbiz.com, 무단 전재 및 재배포 금지 - , ,헤럴드경제,2016-01-26 15:01:00
